{
  "specversion": "1.0",
  "id": "evt_01J9ZC9V3Q",
  "source": "//aegisbastion/detect",
  "type": "com.aegisbastion.alert.v1",
  "subject": "asset/asset_88f3",
  "time": "2026-07-30T07:00:00Z",
  "datacontenttype": "application/json",
  "data": {
    "schema_version": "1.0",
    "event_id": "evt_01J9ZC9V3Q",
    "org_id": "org_acme",
    "source_module": "detect",
    "source_event_id": "fnd_01J9A7K2",
    "authorization_token_id": "tok_01J9ZM8W3F",
    "fingerprint_hint": "sha256:8c41aa2f",
    "title": "Confirmed RCE exposure: PAN-OS command injection",
    "severity": "critical",
    "confidence": "confirmed",
    "category": "vuln",
    "asset": {
      "asset_id": "asset_88f3",
      "kind": "subdomain",
      "identifier": "api.acme.com",
      "criticality": "high"
    },
    "pii_classification": "none",
    "occurred_at": "2026-07-30T06:59:41Z",
    "dedup_window_seconds": 86400,
    "requires_ack": true
  }
}
